letter,question,answer,difficulty
أ,عاصمة اليونان ومهد الحضارة الإغريقية القديمة والفلسفة والألعاب الأولمبية؟,أثينا,متوسط
أ,دولة عربية عريقة في بلاد الشام عاصمتها عمان وتشتهر بمدينة البتراء؟,أردن,متوسط
أ,مخترع المصباح الكهربائي الذي أضاء العالم هو توماس...؟,إديسون,متوسط
أ,أول الخلفاء الراشدين وصاحب النبي في الهجرة هو ... بكر الصديق؟,أبو بكر,متوسط
أ,دولة إسلامية في قارة آسيا عاصمتها كابول وتتميز بتضاريسها الجبلية؟,أفغانستان,متوسط
أ,مدينة إماراتية هي العاصمة السياسية لدولة الإمارات العربية المتحدة؟,أبوظبي,متوسط
أ,قارة شاسعة تقع فيها دول مثل كينيا ونيجيريا وجنوب أفريقيا؟,أفريقيا,متوسط
أ,الحضارة الإسلامية العريقة التي قامت في شبه جزيرة أيبيريا (إسبانيا حالياً)؟,أندلس,متوسط
أ,فيلسوف يوناني شهير كان تلميذاً لأفلاطون ومعلماً للإسكندر الأكبر؟,أرسطو,متوسط
أ,لون يرمز للسلام والصفاء والنقاء ويرفع كراية عند الاستسلام؟,أبيض,سهل
أ,لون من الألوان الأساسية يرمز للحرارة والنشاط وهو لون دم الكائنات الحية؟,أحمر,متوسط
أ,شهر ميلادي يأتي في فصل الربيع ويطلق عليه شعبياً شهر الكذب والمقالب؟,أبريل,سهل
أ,معدن ثمين يعتبر أصلب المواد الطبيعية ويستخدم بكثرة في المجوهرات الفاخرة؟,ألماس,متوسط
أ,حيوان ثديي طويل الأذنين يقفز بسرعة ويضرب به المثل في الجبن والسرعة؟,أرنب,سهل
أ,أكبر قارات العالم من حيث المساحة وعدد السكان وتضم الصين والهند؟,آسيا,متوسط
أ,"حيوان أليف وصبور يلقب بـ ""سفينة الصحراء"" ويتحمل العطش لأيام طوال؟",إبل,سهل
أ,مسرح غنائي إيطالي شهير يعتمد على الغناء الكلاسيكي والتمثيل المسرحي؟,أوبرا,متوسط
أ,فاكهة استوائية لذيذة شكلها يشبه التاج ومغطاة بالقشور الخشنة؟,أناناس,سهل
ب,عاصمة لبنان وتلقب بباريس الشرق وتشتهر بالثقافة والفن والتاريخ؟,بيروت,متوسط
ب,حضارة قديمة قامت في بلاد الرافدين وتشتهر بحدائقها المعلقة وقوانين حمورابي؟,بابل,متوسط
ب,ملكة سبأ التاريخية التي زارت النبي سليمان عليه السلام وذكرت في القرآن؟,بلقيس,متوسط
ب,معركة إسلامية شهيرة وفاصلة وقعت في شهر رمضان المبارك وانتصر فيها المسلمون؟,بدر,متوسط
ب,دولة آسيوية فقيرة عاصمتها دكا وتكثر فيها الفيضانات والأنهار؟,بنغلاديش,متوسط
ب,دولة أوروبية عاصمتها بروكسل وتشتهر بصناعة الشوكولاتة الفاخرة؟,بلجيكا,متوسط
ب,مدينة إيطالية تاريخية غرقت واختفت تحت رماد بركان فيزوف المدمر؟,بومبي,متوسط
ب,غطاء قماشي سميك ومحشو يستخدم للتدفئة أثناء النوم في الليالي الشتوية الباردة؟,بطانية,متوسط
ب,نبات زراعي ينمو تحت الأرض ويستخدم عالمياً في إعداد الرقائق المقلية؟,بطاطس,متوسط
ب,عاصمة ألمانيا وأكبر مدنها وكانت مقسومة بجدار شهير سقط عام 1989؟,برلين,متوسط
ب,مدينة أرجنتينية شهيرة ومزدحمة هي العاصمة السياسية والاقتصادية للبلاد؟,بوينس آيرس,متوسط
ب,مدينة عراقية عريقة تشتهر بالنخيل ومسقط رأس الأديب الجاحظ وتطل على الخليج؟,بصرة,متوسط
ب,عاصمة الصين وأحد أكبر مدن العالم وأكثرها ازدحاماً وتطوراً؟,بكين,متوسط
ب,حيوان ثديي لطيف يأكل الخيزران ويعيش في غابات الصين ويعتبر رمزاً وطنيا لها؟,باندا,متوسط
ب,ما يزرع ويدفن في التربة لينبت ويخرج منه النبات والشجر وتسمى تقاوي أو؟,بذور,متوسط
ب,طائر بحري ضخم يمتلك جراباً كبيراً تحت منقاره لتخزين الأسماك التي يصطادها؟,بجع,متوسط
ب,مادة طبية ومضاد حيوي اكتشفه ألكسندر فلمنج وغير عالم الطب وأنقذ الملايين؟,بنسلين,متوسط
ب,مدينة تاريخية أثرية في الأردن منحوتة في الصخر الوردي وتعتبر من عجائب الدنيا؟,بتراء,متوسط
ت,جزيرة ودولة في شرق آسيا عاصمتها تايبيه وتشتهر بصناعة التكنولوجيا والرقائق؟,تايوان,متوسط
ت,أكبر مدينة في كندا من حيث عدد السكان وتعتبر المركز المالي والتجاري للبلاد؟,تورونتو,متوسط
ت,ضريح رخامي أبيض رائع الجمال في الهند بناه الإمبراطور شاه جهان تخليداً لزوجته؟,تاج محل,متوسط
ت,نبات تزرع أوراقه وتجفف لتصنع منها السجائر وتعتبر مادة ضارة جداً بالصحة؟,تبغ,متوسط
ت,مهنة إنسانية نبيلة يقوم بها مساعدو الأطباء للعناية بالمرضى ومتابعة حالتهم؟,تمريض,متوسط
ت,عملية بيع وشراء السلع والخدمات بين الأفراد أو الدول لتحقيق الربح والنمو الاقتصادي؟,تجارة,متوسط
ت,نقل نص أو كلام من لغة إلى لغة أخرى مع الحفاظ على المعنى والسياق يسمى؟,ترجمة,متوسط
ت,نظام يستخدم لترتيب الأيام والشهور والسنوات مثل الهجري والميلادي؟,تقويم,متوسط
ت,الأخوان أو الأختان اللذان يولدان من نفس الأم في نفس الوقت وحمل واحد يسميان؟,توأم,متوسط
ت,شيء يعلق أو يلبس لاعتقاد بعض الشعوب القديمة والجاهلية أنه يجلب الحظ أو يطرد الشر؟,تميمة,صعب
ت,الشعور بالإرهاق والإعياء الشديد بعد بذل مجهود بدني أو ذهني شاق يسمى؟,تعب,متوسط
ت,عملية حيوية لا إرادية يتم فيها إدخال الأكسجين وإخراج ثاني أكسيد الكربون من الرئتين؟,تنفس,متوسط
ت,العظمة البارزة في أعلى الصدر والتي تربط بين مفصل الكتف وعظمة القص تسمى؟,ترقوة,متوسط
ت,فاكهة صيفية صغيرة الحجم تتنوع ألوانها بين الأحمر والأسود وتستخدم في صناعة المربى؟,توت,متوسط
ت,جهاز طبي وزئبقي يستخدم لقياس درجة حرارة جسم الإنسان أو حرارة الطقس؟,ترمومتر,متوسط
ت,معدن خفيف وصلب جداً ومقاوم للصدأ يستخدم في صناعة الطائرات والمركبات الفضائية؟,تيتانيوم,متوسط
ت,لباس نسائي يغطي النصف السفلي من الجسم من الخصر إلى الأسفل بأطوال مختلفة؟,تنورة,متوسط
ت,رياضة شتوية ممتعة تعتمد على الانزلاق فوق الثلج والجليد باستخدام أحذية خاصة أو ألواح؟,تزلج,متوسط
ث,يوم من أيام الأسبوع في التقويم العربي يأتي بعد يوم الإثنين ويسبق يوم الأربعاء؟,ثلاثاء,متوسط
ث,المرحلة الدراسية التي تسبق المرحلة الجامعية مباشرة وتلي المرحلة المتوسطة تسمى؟,ثانوية,متوسط
ث,إيمان الإنسان القوي بقدراته أو بأمانة وصدق شخص آخر تسمى ... بالنفس أو بالآخرين؟,ثقة,متوسط
ث,التعبير عن الإعجاب والمدح والشكر لشخص ما على صنيعه وعمله الجيد يسمى مديح أو؟,ثناء,متوسط
ث,صفة تطلق على الشيء الذي يزن كثيراً ويصعب حمله أو تحريكه بسهولة وعكسه خفيف؟,ثقيل,متوسط
ث,الشخص الذي يكثر من الكلام والحديث دون فائدة أو انقطاع يسمى في اللغة العربية؟,ثرثار,متوسط
ث,الشخص الذي يملك أموالاً طائلة وعقارات كثيرة ويعيش في رفاهية ويسمى غنياً أو؟,ثري,متوسط
ث,الأجر والجزاء الحسن الذي يناله المؤمن من الله عز وجل على أعماله الصالحة يسمى؟,ثواب,متوسط
ث,الانتقام ورد الأذى بمثله وهو عادة جاهلية وقبلية قديمة نبذها الإسلام وحرمها يسمى؟,ثأر,متوسط
ث,العضو الموجود في أنثى الإنسان والحيوان والذي يفرز الحليب لرضاعة الصغار يسمى؟,ثدي,متوسط
ث,أكلة عربية وشعبية قديمة تتكون من الخبز المقطع والمغموس بمرق اللحم والخضار؟,ثريد,متوسط
ث,المبنى العسكري المخصص لإقامة وسكن الجنود وتدريبهم وحفظ أسلحتهم يسمى ... عسكرية؟,ثكنة,متوسط
ث,الاستقرار والرسوخ وعدم التغير أو التراجع عند مواجهة الصعاب والمواقف الشديدة يسمى؟,ثبات,متوسط
ث,العدد الذي يأتي مباشرة بعد الرقم مائتين وتسعة وتسعين في الحساب والرياضيات؟,ثلثمائة,متوسط
ث,الرقم الذي يمثل ثمانية عشرات في الحساب والرياضيات (80) يقرأ ويكتب باللغة العربية؟,ثمانين,متوسط
ج,دولة عربية إفريقية صغيرة تقع على مضيق باب المندب بالقرن الإفريقي وعاصمتها تحمل نفس اسمها؟,جيبوتي,متوسط
ج,جزر سياحية ساحرة تقع في المحيط الهندي وتعتبر وجهة عالمية شهيرة لقضاء شهر العسل؟,جزر المالديف,متوسط
ج,مدينة سويسرية شهيرة جداً تعتبر مقراً للعديد من المنظمات الدولية ومقر الأمم المتحدة بأوروبا؟,جنيف,متوسط
ج,دولة عربية تتكون من أرخبيل جزر تقع في المحيط الهندي قبالة سواحل إفريقيا الشرقية؟,جزر القمر,متوسط
ج,هضبة سورية جبلية ومرتفعة ومحتلة تتمتع بأهمية استراتيجية ومصادر مياه وفيرة؟,جولان,متوسط
ج,الجزء الأمامي من رأس الإنسان والذي يقع بين الحاجبين ومنبت الشعر يسمى؟,جبهة,متوسط
ج,الغطاء الجلدي الرقيق الذي يغطي العين ويحميها ويتحرك بشكل لا إرادي عند الرمش؟,جفن,متوسط
ج,البناء العمودي الصلب الذي يحيط بالغرفة أو المنزل لحمايته وتقسيمه ويسمى حائط أو؟,جدار,متوسط
ج,بناء هندسي مشيد فوق الأنهار أو الوديان أو الطرق لربط الضفتين وتسهيل العبور يسمى كوبري أو؟,جسر,متوسط
ج,النار الشديدة والعذاب الأليم الذي أعده الله للكافرين والعصاة في الآخرة يسمى جهنم أو؟,جحيم,متوسط
ج,المكان المليء بالنعيم والأنهار والثمار الذي أعده الله للمؤمنين المتقين في الآخرة يسمى الفردوس أو؟,جنة,متوسط
ج,الكيس الصغير المخيط في الملابس أو السراويل لحفظ النقود والمفاتيح والأشياء الصغيرة يسمى؟,جيب,متوسط
ج,المطبوعة الورقية اليومية أو الأسبوعية التي تنقل الأخبار والمقالات وتسمى صحيفة أو؟,جريدة,متوسط
ج,القطعة المشتعلة والمتوهجة من الفحم أو الحطب التي تشع حرارة وناراً تسمى؟,جمرة,متوسط
ج,حالة تصيب الأراضي الزراعية نتيجة انقطاع الأمطار لفترات طويلة وتسبب تشقق التربة تسمى؟,جفاف,متوسط
ح,الوعاء الكبير أو المساحة المقعرة المخصصة لزراعة النباتات أو تجميع المياه للاستحمام تسمى؟,حوض,متوسط
ح,العضو المسؤول عن إصدار الصوت في جسم الإنسان ويقع في الرقبة ويحتوي على الحبال الصوتية؟,حنجرة,متوسط
ح,ابن الابن أو ابن البنت يطلق عليه بالنسبة لجده وجدته في تسلسل العائلة اسم؟,حفيد,متوسط
ح,أم الزوج أو أم الزوجة يطلق عليها في التقاليد وتسميات القرابة العربية اسم؟,حماة,متوسط
ح,عاطفة قوية وشعور عميق بالمودة والميل تجاه شخص أو شيء معين وتعتبر أساس العلاقات الطيبة؟,حب,متوسط
ح,الشعور بالألم النفسي والكآبة والضيق نتيجة فقدان شخص عزيز أو المرور بموقف صعب يسمى كآبة أو؟,حزن,متوسط
ح,الشعور بالعداوة والكراهية الشديدة والضغينة وتمني زوال النعمة عن الآخرين يسمى؟,حقد,متوسط
ح,ما يراه النائم في نومه من خيالات وأحداث متسلسلة قد تكون سعيدة أو مزعجة يسمى رؤيا أو؟,حلم,متوسط
ح,الشيء الثابت والصحيح الذي يطابق الواقع ولا يقبل الشك أو الجدال وعكس الكذب والوهم يسمى؟,حقيقة,متوسط
ح,القصة أو الرواية التي تروى للتسلية أو أخذ العبرة وتكون غالباً من نسج الخيال والأساطير تسمى؟,حكاية,متوسط
ح,القول المأثور والبليغ الذي ينتج عن تجربة وخبرة عميقة في الحياة ويتناقله الناس للفائدة يسمى؟,حكمة,متوسط
ح,أداة مكونة من خيوط أو ألياف مجدولة وقوية جداً ومتينة تستخدم للربط والسحب والتسلق؟,حبل,متوسط
ح,قطع الخشب الجافة المقطوعة من جذوع وفروع الأشجار والمعدة للإشعال والتدفئة في الشتاء يسمى؟,حطب,متوسط
ح,الحرفي والمهني الذي يعمل في تسخين وتشكيل وصناعة الأدوات والأبواب من الحديد يسمى؟,حداد,متوسط
ح,الشخص الذي يمتهن ويحترف قص الشعر وتشذيب اللحية للرجال في الصالونات يسمى؟,حلاق,متوسط
ح,كائن أسطوري خيالي يصور في القصص على شكل نصف امرأة جميلة ونصف سمكة وتعيش في البحر تسمى؟,حورية,متوسط
خ,الأثر الذي يتركه القلم على الورق وله أنواع في اللغة العربية كالرقعة والنسخ والديواني والثلث يسمى؟,خط,متوسط
خ,حرفة وعملية توصيل وربط قطع القماش ببعضها لصنع الملابس والأثواب يدوياً أو بالآلة تسمى؟,خياطة,متوسط
خ,الشخص الذي يحضر ويعجن الدقيق ويخبزه في الفرن لصنع الخبز والمعجنات الطازجة للناس يسمى؟,خباز,متوسط
خ,الشخص الذي يعمل في المنازل لتنظيفها وترتيبها والمساعدة في الأعمال اليومية مقابل أجر يسمى؟,خادم,متوسط
خ,الأشياء المعدنية والآلات القديمة أو التالفة التي يعاد بيعها وصهرها لاستخدامها مجدداً تسمى سكراب أو؟,خردة,متوسط
خ,الدولاب الخشبي أو المعدني المخصص لترتيب وحفظ الملابس والأغراض أو الأموال والمستندات يسمى؟,خزانة,متوسط
خ,حفرة عميقة وطويلة تحفر في الأرض حول المدن أو في المعارك لحماية الجنود وعرقلة الأعداء؟,خندق,متوسط
خ,سلاح أبيض قصير ذو نصل حاد ومقوس يلبس للزينة في بعض الثقافات العربية كالـ ... العماني؟,خنجر,متوسط
خ,غطاء صلب يلبسه الجنود في الحروب أو عمال البناء أو سائقو الدراجات لحماية الرأس من الإصابات تسمى؟,خوذة,متوسط
خ,نبات ورقي أخضر ومقرمش يستخدم كعنصر أساسي في إعداد السلطات والشطائر ويعتبر مفيداً للصحة؟,خس,متوسط
خ,نبات شتوي لذيذ ومفيد للكبد أوراقه خضراء قاسية وقلبه طري ويسمى في بعض الدول أرضي شوكي أو؟,خرشوف,متوسط
خ,سائل حامض جداً يستخرج من تخمير التفاح أو العنب ويستخدم في الطبخ وتتبيل السلطات والتنظيف يسمى؟,خل,متوسط
خ,حيوان ثديي محرم أكله في الإسلام ويربى في المزارع الغربية لاستخدام لحمه ودهنه في صناعاتهم؟,خنزير,متوسط
خ,حشرة صغيرة مغطاة بقشرة صلبة تشبه الدرع وتتغذى على الأوراق وبعضها مفيد للبيئة الزراعية تسمى؟,خنفساء,متوسط
خ,القدرة العقلية على تصور أشياء وأحداث غير موجودة في الواقع وابتكار أفكار جديدة ومبدعة تسمى؟,خيال,متوسط
خ,الشعور بالارتباك والحياء واحمرار الوجه عند مواجهة مواقف اجتماعية أو ارتكاب خطأ بسيط يسمى؟,خجل,متوسط
خ,نقض العهد والأمانة والغدر بالصديق أو إفشاء أسرار الوطن للعدو وهي من أسوأ الصفات الأخلاقية تسمى؟,خيانة,متوسط
د,عاصمة جمهورية أيرلندا وأكبر مدنها وتشتهر بثقافتها ومكتباتها العريقة وتاريخها الأدبي الطويل؟,دبلن,متوسط
د,مدينة هندية كبرى ومزدحمة جداً وفيها يقع مقر العاصمة السياسية للهند وتسمى نيو...؟,دلهي,متوسط
د,النهر العظيم الذي يمر في العراق ويمر بالعاصمة بغداد ويشكل مع نهر الفرات بلاد الرافدين يسمى نهر؟,دجلة,متوسط
د,لوح معدني أو خشبي صلب كان يحمله المقاتل قديماً في يده أثناء المعارك لصد ضربات السيوف والسهام؟,درع,متوسط
د,المحل التجاري الصغير في الأحياء السكنية الذي يبيع السلع الغذائية والاحتياجات اليومية يسمى بقالة أو؟,دكان,متوسط
د,الأموال والمبالغ التي يقترضها الشخص من الآخرين أو البنوك ويجب عليه إعادتها وسدادها في وقتها تسمى؟,ديون,متوسط
د,المرشد السياحي أو الكتاب الذي يحتوي على توجيهات ومعلومات تدلك على الطريق الصحيح أو خطوات التركيب يسمى؟,دليل,متوسط
د,الوثيقة القانونية الأعلى في الدولة التي تحدد نظام الحكم وحقوق وواجبات المواطنين وتخضع لها جميع القوانين؟,دستور,متوسط
د,كلمة عربية أصيلة تعني المنزل أو البيت أو المسكن الذي يأوي إليه الإنسان وعائلته وتسمى بيت أو؟,دار,متوسط
د,وعاء عميق مزود بمقبض يستخدم لرفع المياه من البئر أو نقل السوائل وتنظيف الأرضيات يسمى سطل أو؟,دلو,متوسط
د,ذكر الدجاج ويتميز بعرفه الأحمر الجميل ويشتهر بصياحه المرتفع في الصباح الباكر لإيقاظ الناس؟,ديك,متوسط
د,حشرة طائرة لاذعة تشبه النحلة في شكلها ولكنها مفترسة وتبني أعشاشاً ورقية ومؤلمة جداً عند اللسع يسمى زنبور أو؟,دبور,متوسط
د,فاكهة صيفية ذات قشرة ناعمة مخملية ولون يميل بين الأصفر والأحمر ونواتها صلبة وتسمى في بعض الدول خوخ أو؟,دراق,متوسط
د,المسحوق الأبيض الناعم جداً الناتج عن طحن حبوب القمح ويستخدم في صنع الخبز والمعجنات ويسمى طحين أو؟,دقيق,متوسط
د,المادة الدهنية الموجودة في اللحوم أو الحليب والتي تزيد من السعرات الحرارية وتمنح الطعم الغني وتسمى شحم أو؟,دسم,متوسط
د,الذكاء الشديد والمكر والقدرة العالية على التخطيط وإيجاد الحلول المعقدة والخفية لقلب الموازين يسمى؟,دهاء,متوسط
د,التضرع واللجوء إلى الله عز وجل بالطلب والرجاء والمناجاة ورفع اليدين في السراء والضراء يسمى؟,دعاء,متوسط
ذ,مرض واضطراب عقلي شديد يفقد فيه المريض اتصاله بالواقع ويعاني من الهلوسة البصرية والسمعية والأوهام يسمى؟,ذهان,متوسط
ذ,الشعور بالمهانة والانكسار والضعف وفقدان الكرامة أمام الآخرين نتيجة قهر أو تسلط يسمى هوان أو؟,ذل,متوسط
ذ,كلمة تدل على النفس والشخصية الإنسانية الداخلية وتقال عند التحدث عن النفس بضمير الأنا أو يقال تحقيق الـ؟,ذات,متوسط
ذ,الأحداث والمواقف والصور الماضية المخزنة في العقل والتي نسترجعها بين الحين والآخر ونتحسر عليها أحياناً تسمى؟,ذكريات,متوسط
ذ,الحجة أو العذر أو السبب الوهمي الذي يختلقه الشخص لتبرير أفعاله وتصرفاته غير المقنعة تسمى حجة أو؟,ذريعة,متوسط
ذ,أعلى نقطة وقمة في الجبل أو أعلى مستوى للنجاح والازدهار والتألق في مسيرة الإنسان أو مسار الأحداث تسمى الـ؟,ذروة,متوسط
ذ,حالة الصدمة والاندهاش الشديد والمفاجئ الذي يجعل الشخص عاجزاً عن الكلام أو التفكير المؤقت ويقف حائراً تسمى؟,ذهول,متوسط
ذ,العملية الفيزيائية لتحول المادة من الحالة الصلبة إلى الحالة السائلة بفعل ارتفاع الحرارة مثل وضع الثلج بالشمس تسمى؟,ذوبان,متوسط
ذ,الرصاص والطلقات والقذائف التي تستخدم في الأسلحة النارية والبنادق والمدافع أثناء الحروب والصيد تسمى؟,ذخيرة,متوسط
ذ,صفة تطلق على النبات أو الورد عندما يفقد ماءه ونضارته ويجف ويميل لونه للاصفرار ويقترب من الموت يقال نبات؟,ذابل,متوسط
ذ,الشخص الفطن وسريع البديهة الذي يمتلك قدرة عالية على الاستيعاب والفهم وحل المشكلات المعقدة بسرعة يسمى عبقري أو؟,ذكي,متوسط
ذ,يقال للخبر أو السر الذي ينتشر بسرعة هائلة بين الناس ويشتهر بأنه خبر منتشر ومشهور أو ... الصيت؟,ذائع,متوسط
ذ,ذكر عيوب ومساوئ الشخص وانتقاده بشكل سلبي أمام الآخرين وعكسه المدح والثناء وتعداد المحاسن يسمى؟,ذم,متوسط
ذ,الطرفان العلويان للإنسان اللذان ينتهيان بالكفين ويستخدمان في الحمل والعمل والمصافحة والعناق (بصيغة المثنى)؟,ذراعان,متوسط
