letter,question,answer,difficulty
ت,فرع من فروع علم الفيزياء يدرس العلاقة المعقدة بين الحرارة والطاقة والشغل الحركي؟,ترموديناميكا,متوسط
ت,إعطاء جرعة مخففة أو ميتة من الميكروب للجسم لتحفيز جهاز المناعة على إنتاج أجسام مضادة تقيه مستقبلاً؟,تطعيم,متوسط
ت,علم طبي وبيولوجي يدرس بنية وتركيب أجزاء وأعضاء الكائنات الحية البشرية والحيوانية بالتفصيل؟,تشريح,متوسط
ت,روائي ومفكر روسي عظيم من أشهر أعماله الأدبية الخالدة الرواية الملحمية (الحرب والسلم)؟,تولستوي,متوسط
ث,جهاز كهربائي دقيق يستخدم لتنظيم والتحكم في درجة الحرارة داخل الأنظمة المغلقة كالمكيفات والمحركات؟,ثرموستات,متوسط
ث,نظام حكم سياسي قديم تستمد فيه السلطة شرعيتها وقوانينها من رجال الدين والمؤسسات الدينية؟,ثيوقراطية,متوسط
ث,نظام عددي حاسوبي يعتمد على رقمين فقط هما الصفر والواحد ويعتبر لغة البرمجة الأساسية للآلات؟,ثنائي,متوسط
ث,حركة تحول كبرى بدأت في بريطانيا بانتقال آليات الإنتاج من العمل اليدوي إلى الآلات والمصانع الضخمة؟,ثورة صناعية,متوسط
ث,حيوان زاحف مائي شديد السمية يعيش في المحيطات الاستوائية الدافئة ويستطيع كتم أنفاسه طويلاً تحت الماء؟,ثعبان بحر,متوسط
ث,شكل هندسي مضلع يتكون من ثمانية أضلاع محيطة وزوايا داخلية متساوية في القياس؟,ثماني,متوسط
ث,الاسم الشائع لثاني أكسيد الكربون في حالته الصلبة ويستخدم في التبريد الكيميائي السريع وحفظ الأدوية؟,ثلج جاف,متوسط
ث,عنصر كيميائي مشع يستخدم كوقود آمن وبديل لليورانيوم في الجيل الجديد من المفاعلات النووية؟,ثوريوم,متوسط
ج,قوة فيزيائية كونية غير مرئية تجذب الأجسام ذات الكتلة نحو مركز بعضها البعض وتحفظ توازن الكواكب؟,جاذبية,متوسط
ج,الوحدات البيولوجية الأساسية للوراثة في الكائنات الحية وتتكون من تسلسلات معقدة لحمض الـ دي إن إيه؟,جينات,متوسط
ج,نظام حكم سياسي يختار فيه الشعب ممثليه ورئيسه عبر الانتخابات وصناديق الاقتراع وليس بالوراثة الملكية؟,جمهورية,متوسط
ج,أصغر وحدة في المركب الكيميائي تحتفظ بالخصائص الكيميائية والفيزيائية لذلك المركب بشكل مستقل؟,جزيء,متوسط
ج,علم طبيعي يختص بدراسة بنية كوكب الأرض وتكوينها الصخري وتاريخها والعمليات التي تشكل تضاريسها؟,جيولوجيا,متوسط
ج,السكر البسيط والأساسي الذي يدور في مجرى الدم ويعتبر المصدر الرئيسي والأول لطاقة خلايا الجسم؟,جلوكوز,متوسط
ج,الخريطة الوراثية الكاملة التي تحتوي على كافة المعلومات والتسلسلات الجينية لخلية الكائن الحي؟,جينوم,متوسط
ج,مؤسس وقائد الإمبراطورية المغولية الشرسة التي تعتبر أكبر إمبراطورية أراضٍ متصلة في تاريخ البشرية؟,جنكيز خان,متوسط
ح,صراع سياسي وعسكري واستخباراتي غير مباشر امتد لعقود طويلة بين المعسكرين الشرقي والغربي بعد الحرب العالمية؟,حرب باردة,متوسط
ح,البقايا أو الآثار المحفوظة في الصخور للكائنات الحية القديمة التي عاشت في العصور الجيولوجية السحيقة؟,حفريات,متوسط
ح,مركب كيميائي يتميز بطعمه اللاذع وقدرته العالية على التفاعل مع القواعد لإنتاج الأملاح والماء؟,حمض,متوسط
ح,ألياف بروتينية طبيعية ناعمة وقوية جداً تنتجها وتغزلها دودة القز وتصنع منها أفخر وأغلى الأقمشة؟,حرير,متوسط
ح,عضلة مسطحة وقوية تفصل بين تجويف الصدر وتجويف البطن وتلعب دوراً رئيسياً في عملية التنفس للإنسان؟,حجاب حاجز,متوسط
ح,منظمة عسكرية دولية كبرى تأسست لحماية الدول الأعضاء من أي هجوم مسلح خارجي وتعرف بحلف شمال الأطلسي؟,حلف الناتو,متوسط
ح,الحق الطبيعي للإنسان في التعبير عن رأيه واتخاذ قراراته وممارسة معتقداته دون إجبار أو قيود قمعية؟,حرية,متوسط
ح,الجزيء البيولوجي المعقد الذي يحمل التعليمات الجينية المسؤولة عن نمو وتطور وعمل جميع الكائنات الحية؟,حامض نووي,متوسط
خ,عالم مسلم عظيم يعتبر مؤسس علم الجبر ومكتشف ومطور نظام الأرقام الهندية العربية المستخدمة اليوم؟,خوارزمي,متوسط
خ,نوع من الأنيميا الوراثية الخطيرة تأخذ فيها كريات الدم الحمراء شكلاً هلالياً غير طبيعي يعيق تدفق الدم؟,خلايا منجلية,متوسط
خ,ظاهرة فلكية تحدث عندما تقع الأرض على خط مستقيم بين الشمس والقمر فتحجب نور الشمس عنه تماماً؟,خسوف,متوسط
خ,مادة تصنع من الطين المعالج والمحروق في درجات حرارة عالية جداً وتستخدم في صناعة الأواني والتحف الفنية؟,خزف,متوسط
خ,الوحدات الأساسية والحساسة التي تنقل الإشارات النبضية داخل الدماغ وشبكة جهاز الإنسان العصبي؟,خلايا عصبية,متوسط
خ,حيوان ثديي غريب وبرمائي يستوطن أستراليا يمتلك منقاراً كالبط ويضع البيض ولا يلد كباقي الثدييات؟,خلد الماء,متوسط
خ,الخط الجغرافي الوهمي الذي يقسم الكرة الأرضية عرضياً إلى نصفين متساويين شمالي وجنوبي ودرجة عرضه صفر؟,خط الاستواء,متوسط
خ,الممارسة الفلسفية القديمة التي حاولت تحويل المعادن الرخيصة كالرصاص إلى ذهب وتعتبر سلف علم الكيمياء؟,خيمياء,متوسط
د,نظام سياسي يعني حرفياً (حكم الشعب) وتتخذ فيه القرارات بناء على تصويت الأغلبية ومشاركة المواطنين؟,ديمقراطية,متوسط
د,فن إدارة العلاقات السياسية والمفاوضات المعقدة بين الدول لحل النزاعات بطرق سلمية وتجنب الحروب؟,دبلوماسية,متوسط
د,ناقل عصبي كيميائي وهرمون يفرزه الدماغ ويلعب دوراً رئيسياً في الشعور بالمكافأة والتحفيز والسعادة؟,دوبامين,متوسط
د,فرع من علم الميكانيكا الفيزيائية يدرس القوى المسببة لحركة الأجسام المادية وتأثير تلك القوى عليها؟,ديناميكا,متوسط
د,نظام حكم سياسي شمولي وقمعي تتركز فيه السلطة المطلقة في يد شخص واحد أو حزب ولا يسمح بالمعارضة؟,دكتاتورية,متوسط
د,السجلات والمقرات الحكومية الإدارية التي أسسها الخليفة عمر بن الخطاب لتنظيم شؤون الدولة الإسلامية مالياً وعسكرياً؟,دواوين,متوسط
د,فيلسوف وعالم رياضيات فرنسي عظيم يعتبر أباً للفلسفة الحديثة وصاحب المقولة الشهيرة (أنا أفكر، إذن أنا موجود)؟,ديكارت,متوسط
ذ,فرع متطور من علوم الحاسوب يهدف لابتكار آلات وخوارزميات تحاكي القدرات الذهنية وطرق تفكير البشر؟,ذكاء اصطناعي,متوسط
ذ,التهاب حاد ومعدٍ يصيب الحويصلات الهوائية في إحدى الرئتين أو كلتيهما مسبباً صعوبة شديدة وآلاماً في التنفس؟,ذات الرئة,متوسط
ذ,حشرة إفريقية خطيرة جداً تنقل طفيليات مدمرة تسبب مرض النوم القاتل للإنسان والحيوانات؟,ذباب تسي تسي,متوسط
ذ,مرض مناعي ذاتي مزمن ومعقد يهاجم فيه جهاز المناعة عن طريق الخطأ أنسجة وأعضاء الجسم السليمة؟,ذئبة حمراء,متوسط
ذ,ظاهرة بيئية خطيرة ناتجة عن التغير المناخي والاحتباس الحراري تهدد بارتفاع منسوب مياه المحيطات عالمياً؟,ذوبان جليدي,متوسط
ذ,مصطلح فيزيائي وعسكري يطلق على الطاقة الهائلة والمفزعة الناتجة عن انشطار أو اندماج نواة العنصر المشع؟,ذري,متوسط
ذ,طلقات نارية حقيقية تحتوي على مقذوف معدني ومادة متفجرة تستخدم في المعارك والحروب الفعلية وليس للتدريب؟,ذخيرة حية,متوسط
ذ,اللقب التاريخي الذي أطلق على الصحابي الجليل والخليفة الثالث عثمان بن عفان لزواجه من ابنتي رسول الله؟,ذو النورين,متوسط
ر,آلة ميكانيكية أو إلكترونية ذكية مبرمجة للقيام بمهام معقدة وشاقة أو دقيقة بدلاً من الجهد البشري؟,روبوت,متوسط
ر,نظام اقتصادي عالمي يعتمد على الملكية الخاصة لوسائل الإنتاج وتشغيله في الأسواق الحرة لتحقيق الربح وتراكم الثروة؟,رأسمالية,متوسط
ر,تقنية تصوير طبي متطورة وآمنة تستخدم مجالات كهرومغناطيسية قوية لتكوين صور دقيقة ومفصلة لأعضاء الجسم الداخلية؟,رنين مغناطيسي,متوسط
ر,مقياس علمي لوغاريتمي دولي ومفتوح ابتكره عالم أمريكي ويستخدم لقياس وتسجيل قوة وشدة الهزات الأرضية والزلازل؟,ريختر,متوسط
ر,دولة إفريقية قهرت الصعاب وشهدت إبادة جماعية مروعة في التسعينيات ثم نهضت لتصبح من أنظف وأكثر الدول تطوراً؟,رواندا,متوسط
ر,عمل أدبي نثري طويل يروي قصة متسلسلة تعتمد على الخيال أو الواقع وتضم شخصيات وحبكة درامية معقدة؟,رواية,متوسط
ر,العضو الأنثوي العضلي المجوف الذي يحتضن البويضة المخصبة ويغذي الجنين طوال فترة الحمل وحتى لحظة الولادة؟,رحم,متوسط
ز,عضو ليمفاوي صغير يقع في بداية الأمعاء الغليظة للإنسان وقد يتعرض لالتهاب حاد ومفاجئ يستدعي استئصاله جراحياً؟,زائدة دودية,متوسط
ز,عنصر كيميائي شديد السمية لا لون ولا طعم له اشتهر استخدامه قديماً في حوادث الاغتيالات والتسميم السياسي السري؟,زرنيخ,متوسط
ز,الركن الثالث من أركان الإسلام وهو مقدار محدد شرعاً من المال يخرج سنوياً للفقراء والمستحقين لتطهير الثروة؟,زكاة,متوسط
ز,المعابد المدرجة والهرمية الشكل التي بناها السومريون والبابليون في بلاد الرافدين القديمة للتقرب من آلهتهم؟,زقورة,متوسط
ز,زهرة ربيعية جميلة ذات ألوان زاهية اتخذتها الإمبراطورية العثمانية رمزاً لها وتشتهر بها هولندا وتصدرها عالمياً حالياً؟,زهرة التوليب,متوسط
ز,البئر المقدسة والمباركة في مكة المكرمة التي تفجرت تحت قدمي النبي إسماعيل عليه السلام بأمر الله ولا زالت تتدفق؟,زمزم,متوسط
ز,موسيقي ومغني عباسي شهير أحدث ثورة كبرى في الموسيقى الأندلسية وأضاف الوتر الخامس للعود وأسس قواعد الإتيكيت؟,زرياب,متوسط
ز,الزاوية الهندسية الأساسية التي يبلغ قياسها 90 درجة وتتكون من تعامد خطين مستقيمين تماماً؟,زاوية قائمة,متوسط
س,فيلسوف يوناني كلاسيكي عظيم أُجبر على تجرع السم بسبب أفكاره التنويرية ويعتبر المؤسس الحقيقي للفلسفة الغربية؟,سقراط,متوسط
س,حركة فنية وأدبية حديثة تعتمد على التعبير عن العقل الباطن والأحلام والصور الغريبة وغير المنطقية كمدرسة سلفادور دالي؟,سريالية,متوسط
س,تقنية بحرية تستخدم انتشار وانعكاس الموجات الصوتية تحت الماء للتنقل أو للكشف عن الغواصات وقياس أعماق المحيط؟,سونار,متوسط
س,مقطوعة موسيقية كلاسيكية طويلة ومؤلفة خصيصاً لتعزفها الأوركسترا الكاملة وتتكون عادة من أربع حركات متناغمة؟,سمفونية,متوسط
س,عنصر شبه موصل يستخدم بكثرة في صناعة الرقائق الإلكترونية وسمي وادي أمريكي شهير للتقنية باسمه؟,سيليكون,متوسط
س,إحدى السلطات الثلاث الأساسية في الدولة ومهمتها تنفيذ القوانين وإدارة الشؤون اليومية والسياسية للبلاد والمواطنين؟,سلطة تنفيذية,متوسط
س,وحدة قياس فلكية هائلة تمثل المسافة التي يقطعها الضوء في الفراغ خلال مدة زمنية قدرها سنة أرضية كاملة؟,سنة ضوئية,متوسط
س,العلم الأكاديمي والتطبيقي الذي يدرس السلوك البشري والعمليات العقلية ودوافع الإنسان وطرق تفكيره؟,سيكولوجيا,متوسط
ش,نظام سياسي واقتصادي شمولي يهدف إلى إلغاء الملكية الخاصة لوسائل الإنتاج وإقامة مجتمع موحد بلا طبقات اجتماعية؟,شيوعية,متوسط
ش,أكبر وأهم شريان في جسم الإنسان ويقوم بتوزيع الدم النقي والمؤكسج من القلب المندفع إلى باقي جميع الأعضاء؟,شريان أورطي,متوسط
ش,مجموعة القواعد والتعليمات الكيميائية المخزنة في الحمض النووي والتي تحدد صفات الكائن الحي وتنتقل بالوراثة؟,شفرة وراثية,متوسط
ش,مساحة شاسعة من اليابسة تحيط بها مياه البحر من ثلاث جهات فقط وتتصل باليابسة الأم من الجهة الرابعة وتسمى؟,شبه جزيرة,متوسط
ش,اضطراب عقلي مزمن ومعقد يؤثر على طريقة تفكير الشخص وشعوره وسلوكه ويجعله منفصلاً عن الواقع ويسمى الفصام أو؟,شيزوفرينيا,متوسط
ش,الطبقة العصبية الحساسة جداً للضوء والمبطنة للجزء الخلفي الداخلي من العين والتي تنقل الصور للدماغ عبر العصب البصري؟,شبكية,متوسط
ش,هياكل حجرية بحرية خلابة تبنيها الكائنات الحية وتعتبر بيئة خصبة وحاضنة لربع الأسماك البحرية وتتأثر بالاحتباس الحراري؟,شعب مرجانية,متوسط
ش,صخرة فضائية صغيرة تحترق وتتوهج بقوة عند دخولها الغلاف الجوي للأرض بسبب الاحتكاك وتسمى أحياناً بالنجم الهاوي؟,شهاب,متوسط
ص,الحملات العسكرية الأوروبية التي انطلقت في العصور الوسطى للسيطرة على الأراضي المقدسة في الشرق وتأسيس إمارات هناك؟,صليبيين,متوسط
ص,التراكيب الحيوية الموجودة داخل غرف القلب والتي تسمح بتدفق الدم في اتجاه واحد سليم وتمنع رجوعه للخلف؟,صمامات,متوسط
ص,اضطراب عصبي مؤلم يسبب آلاماً نابضة وشديدة جداً عادة ما تكون في جانب واحد من الرأس ويصاحبها غثيان ويسمى الشقيقة أو؟,صداع نصفي,متوسط
ص,القطاع الاقتصادي الحيوي المهتم بتحويل ومعالجة المواد الخام الطبيعية إلى منتجات نهائية قابلة للاستخدام عبر الآلات والمصانع؟,صناعة,متوسط
ص,مؤسسة مالية دولية أنشئت لتعزيز التعاون النقدي العالمي وتوفير قروض وإصلاحات اقتصادية للدول التي تعاني أزمات مالية طاحنة؟,صندوق النقد,متوسط
ص,خلايا صغيرة جداً وضرورية في مجرى الدم تلعب الدور الأساسي والأول في عملية التخثر ووقف النزيف عند الجروح؟,صفيحات دموية,متوسط
ص,ظاهرة فيزيائية صوتية تتمثل في ارتداد وعودة الموجات الصوتية لتردد نفس الكلام بعد اصطدامها بحاجز صلب وعال كالجبال؟,صدى,متوسط
ص,قائد مسلم أسطوري وفارس شهم أسس الدولة الأيوبية واستعاد مدينة القدس بعد معركة حطين التاريخية ضد الصليبيين؟,صلاح الدين,متوسط
ض,قوة دفع الدم على جدران الأوعية الدموية أثناء دوران الدورة الدموية ويعتبر ارتفاعه المستمر مرضاً خطيراً يسمى القاتل الصامت؟,ضغط دم,متوسط
ض,تلوث جوي خانق يمزج بين الدخان الكثيف والضباب ويتكون عادة في المدن الصناعية الكبرى ويسبب أمراضاً تنفسية خطيرة؟,ضباب دخاني,متوسط
ض,حركة هجومية قاضية في رياضة الملاكمة تسقط الخصم على الأرض وتفقده الوعي أو القدرة على إكمال النزال قبل انتهاء العد؟,ضربة قاضية,متوسط
ض,حركة سياسية وعسكرية سرية قادها مجموعة من ضباط الجيش المصري وأدت لإنهاء الملكية وإعلان الجمهورية عام 1952 وتسمى حركة الـ؟,ضباط أحرار,متوسط
ض,الغدة الكبيرة البارزة في إناث الحيوانات كالأبقار والأغنام والمسؤولة عن إنتاج وتخزين الحليب لتغذية صغارها واستفادة البشر؟,ضرع,متوسط
ض,مصطلح طبي يشير إلى تراجع أو نقص في حجم وشكل العضلات أو الأعضاء بسبب قلة الاستخدام أو سوء التغذية أو المرض؟,ضمور,متوسط
ض,أنواع برمائية صغيرة وجميلة الألوان تعيش في غابات الأمازون وتفرز سماً قاتلاً جداً من جلدها استخدمه الهنود الحمر لسهامهم؟,ضفادع سامة,متوسط
ض,الوزن والقوة التي يبذلها عمود الهواء على مساحة معينة من سطح الأرض ويقاس بجهاز البارومتر ويؤثر على تغيرات الطقس؟,ضغط جوي,متوسط
ط,المصادر الطبيعية للطاقة التي تتجدد باستمرار ولا تنفد بمرور الزمن كالشمس والرياح والمياه وتعتبر صديقة للبيئة تماماً؟,طاقة متجددة,متوسط
ط,الكائنات الحية الدقيقة التي تعيش على أو داخل كائن حي آخر (المضيف) وتتغذى منه مسببة له الأمراض والضعف؟,طفيليات,متوسط
ط,تغير مفاجئ ودائم في التسلسل الجيني أو الحمض النووي للكائن الحي قد يؤدي لظهور صفات جديدة ومختلفة تماماً؟,طفرة,متوسط
ط,تقنية حديثة ومبتكرة تقوم بصنع مجسمات حقيقية ملموسة عن طريق بناء طبقات متراكمة من المواد بناءً على تصميم رقمي؟,طابعة ثلاثية الأبعاد,متوسط
ط,الفرع المتخصص من الطب الذي يتعامل مع القضايا الجنائية والقانونية كتشريح الجثث لمعرفة أسباب الوفاة والجرائم الغامضة؟,طب شرعي,متوسط
ط,الطاقة النظيفة المستمدة والمحولة مباشرة من إشعاعات الشمس باستخدام ألواح خاصة لتوليد الكهرباء وتسخين المياه؟,طاقة شمسية,متوسط
ط,المدى الكامل لجميع الترددات الممكنة للإشعاع الكهرومغناطيسي بدءاً من أشعة جاما القوية وصولاً إلى موجات الراديو الطويلة؟,طيف كهرومغناطيسي,متوسط
ط,مركبة جوية تقنية ومتقدمة يتم التحكم فيها وتوجيهها عن بعد وتستخدم في التصوير الجوي والعمليات العسكرية والتوصيل الحديث؟,طائرة بدون طيار,متوسط
ظ,ظاهرة مناخية عالمية خطيرة تتمثل في ارتفاع درجات حرارة الأرض بسبب تراكم غازات الكربون في الغلاف الجوي؟,ظاهرة الدفيئة,متوسط
ظ,منطقة جغرافية جافة تقع خلف سلسلة جبلية ضخمة تمنع وصول الرياح المحملة بالأمطار إليها فتصبح قاحلة وتسمى منطقة؟,ظل المطر,متوسط
ظ,كلمة تستخدم في علم النحو والقواعد العربية لتدل على اسم منصوب يبين مكان وقوع الفعل مثل (أمام) و(خلف)؟,ظرف مكان,متوسط
ظ,نسيج خلوي حيوي يغطي الأسطح الخارجية للجسم مثل الجلد ويبطن التجاويف الداخلية للأعضاء والأوعية لحمايتها وإفراز المواد؟,ظهارة,متوسط
ظ,المصطلح الرياضي والهندسي الذي يطلق على النسبة بين الضلع المقابل والضلع المجاور للزاوية الحادة في المثلث قائم الزاوية؟,ظل الزاوية,متوسط
ظ,حدث طبيعي وعلمي نادر ومبهر يحدث في الفضاء ويمكن رصده من الأرض كمرور المذنبات أو كسوف الشمس العميق؟,ظاهرة فلكية,متوسط
ظ,نوع من الغزلان الصحراوية شديدة البياض والجمال تمتلك قروناً طويلة ومستقيمة وتتخذها بعض الدول العربية رمزاً لخطوط طيرانها؟,ظبي المها,متوسط
ظ,نمو غير طبيعي لنسيج لحمي مثلث الشكل على بياض العين قد يمتد للقرنية ويسبب ضعفاً في الرؤية ويسمى طبياً مرض الـ؟,ظفرة,متوسط
ع,الفترة التاريخية الثقافية والفنية العظيمة التي بدأت في إيطاليا وانتقلت لأوروبا ومثلت الانتقال من العصور الوسطى للعصر الحديث؟,عصر النهضة,متوسط
ع,ظاهرة سياسية واقتصادية حديثة تعني تداخل وترابط اقتصادات وثقافات دول العالم لتصبح كقرية واحدة مفتوحة الحدود والأسواق؟,عولمة,متوسط
ع,الإمبراطورية الإسلامية الكبرى التي امتدت في ثلاث قارات وحكمت لقرون طويلة واتخذت من إسطنبول عاصمة أبدية لها؟,عثمانيين,متوسط
