letter,question,answer,difficulty
ر,الشيء الثابت والمتين الذي لا يتزعزع كالوتد في الأرض أو المبدأ في العقل يقال مبدأ؟,راسخ,متوسط
ر,الشخص الذي يستقل وسائل النقل المختلفة كالطائرة أو القطار أو السيارة للانتقال من مكان لآخر؟,راكب,متوسط
ز,الوعاء المصنوع من الزجاج لحفظ السوائل كالمياه والعصائر والعطور؟,زجاجة,متوسط
ز,حجر كريم نفيس يتميز بلونه الأخضر الفاتح المائل للصفرة ويستخدم في صياغة المجوهرات؟,زبرجد,متوسط
ز,العواصف الهوائية القوية والحلزونية التي ترفع الأتربة والأشياء في الهواء بقوة مدمرة؟,زوابع,متوسط
ز,الغرف الضيقة جداً والمظلمة داخل السجون والمخصصة لعزل وحبس المجرمين؟,زنازين,متوسط
ز,الأشخاص والعملاء الذين يترددون على المتاجر لشراء السلع والحصول على الخدمات؟,زبائن,متوسط
ز,الحفل الكبير والبهيج الذي يقام بمناسبة زواج شخصين وإعلان ارتباطهما رسمياً؟,زفاف,متوسط
ز,القطعة الواحدة من الحجر الكريم شديد الخضرة واللمعان والذي يعتبر من أغلى الجواهر؟,زمردة,متوسط
ز,القادة والرؤساء الذين يمتلكون السلطة والقرار في دولهم أو أحزابهم السياسية؟,زعماء,متوسط
ز,نقاط التقاء الخطوط المستقيمة في الأشكال الهندسية وتكون قائمة أو حادة أو منفرجة؟,زوايا,متوسط
ز,الطعام والشراب الذي يأخذه المسافر معه في رحلته الطويلة ليتقوت به ويقال عنه؟,زاد,متوسط
ز,الكذب والخداع والشيء المقلد والمزور الذي يظهر بغير حقيقته وباطنه؟,زيف,متوسط
ز,الخطأ غير المتعمد والسقطة العابرة في الكلام أو التصرف ويقال لكل عالم؟,زلة,متوسط
ز,علاقة الود والرفقة المهنية بين الأشخاص الذين يعملون في نفس المكان أو يدرسون معاً؟,زمالة,متوسط
ز,الشخص الذي يترك ملذات الدنيا طواعية ويكتفي بالقليل تقرباً لله سبحانه وتعالى؟,زاهد,متوسط
ز,فن تزيين وتجميل المباني والأوراق والأسطح بالنقوش الهندسية والنباتية البديعة؟,زخرفة,متوسط
س,الأسلحة البيضاء الطويلة والحادة التي كانت تستخدم في المعارك والمبارزات القديمة؟,سيوف,متوسط
س,المركبات المائية الضخمة التي تمخر عباب المحيطات لنقل البضائع والركاب؟,سفن,متوسط
س,الأشخاص الذين يمارسون ألعاب الخفة والخداع البصري أو الشعوذة المذمومة؟,سحرة,متوسط
س,الأقمشة التي تعلق على النوافذ لحجب أشعة الشمس وتوفير الخصوصية في المنازل؟,ستائر,متوسط
س,المعرض الترفيهي المتنقل الذي يضم ألعاباً بهلوانية وحيوانات مدربة لإمتاع الجمهور؟,سيرك,متوسط
س,المقار والممثليات الدبلوماسية الرسمية التابعة للدول والموجودة في عواصم الدول الأخرى؟,سفارات,متوسط
س,المسافرون والزوار الذين يتنقلون بين البلدان بهدف الترفيه والاستكشاف والاستجمام؟,سياح,متوسط
س,الوسطاء الذين يسهلون عمليات البيع والشراء بين الأطراف كالعقارات والأسهم مقابل عمولة؟,سماسرة,متوسط
س,الزواحف البطيئة التي تحمل دروعاً صلبة على ظهورها لحمايتها وتعيش لسنوات طويلة؟,سلاحف,متوسط
س,الأدوات والآلات المتنوعة التي تستخدم لمعرفة الوقت وتنظيم المواعيد أو الفترات الزمنية؟,ساعات,متوسط
س,وحدات قياس الطاقة التي يحصل عليها الجسم من الطعام ويحرقها بالمجهود البدني تسمى؟,سعرات حرارية,متوسط
س,اللص الذي يأخذ أموال وممتلكات الآخرين خفية وبدون وجه حق وبطرق ملتوية؟,سارق,متوسط
س,الشخص المكلف بنقل وإيصال الرسائل والطرود البريدية إلى المنازل والشركات؟,ساعي,متوسط
ش,النجوم المركزية الملتهبة التي تدور حولها الكواكب وتمدها بالضوء والحرارة في المجرات؟,شموس,متوسط
ش,الشيء أو الملابس التي تخص وتلائم فصل الشتاء البارد وتتميز بالدفء والسمك؟,شتوي,متوسط
ش,النباتات الخشبية الصغيرة والمتفرعة التي لا تصل لحجم وطول الأشجار الكبيرة؟,شجيرات,متوسط
ش,حبوب زراعية غنية بالألياف ومفيدة جداً تستخدم عادة كوجبة إفطار صحية وتغلى مع الحليب؟,شوفان,متوسط
ش,رجل الأمن المرتدي للزي الرسمي والمسؤول عن حفظ النظام وتطبيق القانون في الشوارع؟,شرطي,متوسط
ش,القسم أو النصف من الشيء ويستخدم في الشعر للإشارة إلى نصف البيت الشعري؟,شطر,متوسط
ش,الكتاب والأدباء الذين يبرعون في نظم القصائد الموزونة والمقفاة للتعبير عن المشاعر؟,شعراء,متوسط
ش,الميل القوي والحب العنيف والاهتمام المطلق الذي يمتلك قلب الإنسان تجاه هواية أو عمل؟,شغف,متوسط
ش,الامتداد البارز والمكشوف في الطوابق العليا للمبنى والذي يطل على الشارع؟,شرفة,متوسط
ش,عقد التعاون والاتفاق المبرم بين طرفين أو أكثر لإنشاء وإدارة مشروع تجاري يتقاسمون أرباحه؟,شراكة,متوسط
ش,المناطق الجبلية المنحدرة التي تتدفق وتسقط منها مياه الأنهار بقوة نحو الأسفل؟,شلالات,متوسط
ش,الخبر الكاذب والقصة الملفقة التي تتناقلها الألسن وتنتشر في المجتمع دون دليل؟,شائعة,متوسط
ش,القطع المعدنية الرقيقة شديدة الحدة المستخدمة في الحلاقة أو الجراحة أو الأكواد السرية؟,شفرات,متوسط
ش,مركبة النقل البري الكبيرة والمخصصة لنقل البضائع الثقيلة والمواد بين المدن والدول؟,شاحنة,متوسط
ش,المكان أو المنصب الوظيفي الخالي والمتاح الذي لم يتم تعيين أي شخص فيه بعد يقال منصب؟,شاغر,متوسط
ص,الطيور الجارحة القوية والسريعة التي تستخدم في رياضة الصيد وتتميز بحدة بصرها؟,صقور,متوسط
ص,المساحات الجغرافية الشاسعة والقاحلة التي تغطيها الرمال وتندر فيها المياه والنباتات؟,صحاري,متوسط
ص,شجرة حرجية دائمة الخضرة أوراقها كالإبر وتنتج مخاريط خشبية بداخلها بذور لذيذة؟,صنوبر,متوسط
ص,المركبات الأسطوانية المندفعة بقوة هائلة نحو الفضاء أو المستخدمة كأسلحة مدمرة؟,صواريخ,متوسط
ص,المتجر والمؤسسة الصحية المخصصة لبيع الأدوية والمستلزمات الطبية وتحضير الوصفات؟,صيدلية,متوسط
ص,اللقطات الفوتوغرافية أو الرسومات الفنية التي توثق اللحظات والأشخاص والمناظر؟,صور,متوسط
ص,الأداة الصغيرة التي ينفخ فيها الحكم لإصدار صوت حاد وعال لإيقاف اللعب في المباريات؟,صافرة,متوسط
ص,العلاقة الإنسانية النبيلة والمبنية على الود والثقة والصدق بين شخصين لا تربطهما قرابة دم؟,صداقة,متوسط
ص,السكوت وعدم التحدث أو إصدار أي صوت وهو أبلغ من الكلام في بعض المواقف؟,صمت,متوسط
ص,الحدث غير المتوقع والذي يقع فجأة دون تخطيط مسبق أو ترتيب ويقال التقيت به؟,صدفة,متوسط
ص,واجب ديني وأخلاقي عظيم يتمثل في زيارة الأقارب وتفقدهم والإحسان إليهم ويسمى؟,صلة رحم,متوسط
ص,العبادات والأدعية المفروضة التي يؤديها المسلمون خمس مرات في اليوم والليلة؟,صلوات,متوسط
ص,الشخص الممتنع إرادياً عن الأكل والشرب والمفطرات من الفجر وحتى غروب الشمس؟,صائم,متوسط
ص,الشخص الحازم والشديد في قراراته والذي لا يتساهل في تطبيق القوانين والنظام؟,صارم,متوسط
ص,الحرفي أو العامل الماهر الذي يقوم بتصميم وتجميع المواد لإنتاج سلعة مفيدة؟,صانع,متوسط
ض,حيوانات برمائية تقفز بمهارة وتصدر صوتاً مزعجاً ليلاً يسمى النقيق وتعيش قرب المستنقعات؟,ضفادع,متوسط
ض,الغيوم الكثيفة والمنخفضة جداً التي تلامس سطح الأرض وتعيق الرؤية الأفقية للمسافرين؟,ضباب,متوسط
ض,المنطقة السكنية الممتدة على أطراف المدينة الكبرى وتتميز بالهدوء والابتعاد عن الزحام؟,ضاحية,متوسط
ض,الأصوات العالية جداً والمختلطة والمزعجة التي تسبب التوتر وتلوث البيئة السمعية؟,ضجيج,متوسط
ض,العسكريون الذين تخرجوا من الكليات العسكرية ويحملون رتباً قيادية في الجيش والشرطة؟,ضباط,متوسط
ض,الزوار والأشخاص الذين تستقبلهم في منزلك وتقدم لهم الكرم والضيافة وحسن الاستقبال؟,ضيوف,متوسط
ض,الصوت الصادر عن الإنسان تعبيراً عن الفرح والسرور نتيجة لموقف طريف أو نكتة مضحكة؟,ضحكة,متوسط
ض,الجانب اليابس والمحاذي لمجرى النهر أو الوادي والذي يحصر المياه بينه وبين الجانب الآخر؟,ضفة,متوسط
ض,الأشخاص الذين لا يمتلكون القوة الجسدية أو النفوذ ويحتاجون للمساعدة والحماية في المجتمع؟,ضعفاء,متوسط
ض,قطع القماش والشاش الطبي المعقم التي تستخدم للف الجروح ووقف النزيف؟,ضمادات,متوسط
ض,العهود والمواثيق المالية أو القانونية التي تكفل حفظ الحقوق وتعويض الخسائر عند الإخلال؟,ضمانات,متوسط
ض,الأشخاص المتضررون والذين فقدوا حياتهم أو أموالهم نتيجة الكوارث الطبيعية أو الحوادث؟,ضحايا,متوسط
ض,الحاجة الماسة والقصوى لشيء لا يمكن الاستغناء عنه أبداً ويقال فلان فعل كذا للـ؟,ضرورة,متوسط
ض,حالة فقدان التوجيه والمسار الصحيح وعدم القدرة على العودة للمكان الأصلي؟,ضياع,متوسط
ض,صفة تطلق على الحيوان المفترس والشرس جداً الذي يفترس الكائنات الأخرى بلا رحمة؟,ضاري,متوسط
ط,المركبات الجوية المجنحة والمزودة بمحركات والتي تنقل الركاب عبر الدول والقارات؟,طائرات,متوسط
ط,طيور جميلة ومغترة تفرد ذيولها ذات الألوان الزاهية كالمروحة للتباهي وجذب الإناث؟,طواويس,متوسط
ط,مجموعة الأشخاص المؤهلين الذين يعملون معاً كفريق واحد لتشغيل طائرة أو سفينة أو مستشفى؟,طاقم,متوسط
ط,التراب الناعم المبلل بالماء واللزج والذي تحمله مياه الأنهار وترسبه على ضفافها ليزيد خصوبتها؟,طمي,متوسط
ط,قطع الأثاث المسطحة والمرفوعة على قوائم والتي تستخدم للأكل أو العمل أو وضع الأشياء؟,طاولات,متوسط
ط,القوى الفيزيائية والحيوية الكامنة والمختلفة كالشمسية والكهربائية والحركية؟,طاقات,متوسط
ط,المرحلة العمرية المبكرة والبريئة من حياة الإنسان قبل البلوغ وتتميز باللعب والتعلم السريع؟,طفولة,متوسط
ط,الآلات الموسيقية الإيقاعية المجوفة التي يضرب عليها بالعصي لإصدار الأصوات في الاحتفالات؟,طبول,متوسط
ط,الأشخاص المحترفون والمتخصصون في فنون الطبخ وإعداد أشهى الأطباق في المطاعم والفنادق؟,طهاة,متوسط
ط,الرجال والنساء المدربون والمؤهلون لقيادة الطائرات المدنية والحربية بمهارة في الأجواء؟,طيارون,متوسط
ط,الممرات والشوارع المعبدة التي تربط بين المدن والأحياء وتستخدم لسير المركبات والمشاة؟,طرقات,متوسط
ط,الكائن الحي الذي يغطيه الريش ويمتلك أجنحة ومنقاراً ويتكاثر بوضع البيض ويحلق في الجو؟,طائر,متوسط
ط,العادات والتقاليد والممارسات الدينية أو الاجتماعية التي تقام بطريقة محددة ومتكررة؟,طقوس,متوسط
ط,القصاصة الورقية الصغيرة والمزخرفة التي تلصق على المغلفات والرسائل لإثبات دفع رسوم البريد؟,طابع,متوسط
ط,صفة تطلق على الخضروات واللحوم والمخبوزات حديثة التحضير والتي لم تفسد أو تذبل؟,طازج,متوسط
ظ,حيوانات صحراوية رشيقة وسريعة جداً وجميلة العيون وتعتبر من أنواع الغزلان؟,ظباء,متوسط
ظ,الانعكاس المعتم والداكن الذي يظهر على الأرض خلف الجسم عندما يحجب أشعة الشمس؟,ظل,متوسط
ظ,الأحوال والأوضاع الصعبة والقاهرة التي تحيط بالإنسان وتجعل حياته مليئة بالمشقة يقال؟,ظروف قاسية,متوسط
ظ,الجهة الخلفية من جسم الإنسان الممتدة من أسفل الرقبة إلى الحوض وتحتوي على العمود الفقري؟,ظهر,متوسط
ظ,الأحداث والأشياء العظيمة والمؤثرة التي تحدث في الطبيعة كالزلازل والبراكين ويصعب التحكم بها؟,ظواهر طبيعية,متوسط
ظ,الغياب التام للضوء وتراكم السواد وانعدام الرؤية في الأماكن المغلقة أو في الليل البهيم؟,ظلمة,متوسط
ظ,المساند والداعم الذي يقف في صفك ويحميك أو مركز اللاعب المدافع في أطراف الملعب الكروي؟,ظهير,متوسط
ظ,الاعتقاد والشك والتخمين الذي يميل للصدق أو الكذب دون وجود يقين أو دليل قاطع ويسمى الـ؟,ظن,متوسط
ظ,خفة الدم وسرعة البديهة والقدرة على إطلاق النكت اللطيفة التي تدخل السرور على الآخرين تسمى؟,ظرافة,متوسط
ظ,مركز اللاعب المدافع في تشكيلة كرة القدم والذي يتمركز في الجهة اليمنى للملعب يسمى؟,ظهير أيمن,متوسط
ظ,مركز اللاعب المدافع في تشكيلة كرة القدم والذي يتمركز في الجهة اليسرى للملعب يسمى؟,ظهير أيسر,متوسط
ظ,المساحة الباردة والمظللة التي توفرها أوراق وأغصان الشجرة وتحجب أشعة الشمس الحارقة تسمى؟,ظل الشجرة,متوسط
ظ,الشعور القاسي والمؤلم بالحاجة الملحة لقطرة ماء نتيجة الانقطاع الطويل عن الشرب يسمى؟,ظمأ شديد,متوسط
ظ,السطح الخارجي والشكل الواضح للأشياء والذي يمكن رؤيته بالعين المجردة وعكسه الباطني؟,ظاهري,متوسط
ظ,الأشخاص المعتدون الذين يسلبون حقوق غيرهم ولا يحكمون بالعدل ويستحقون العقاب؟,ظالمون,متوسط
ع,المدن الرئيسية والمركزية التي تتواجد فيها مقار الحكومات والوزارات في كل دولة؟,عواصم,متوسط
ع,الأكوان والبيئات المختلفة والمتباعدة سواء كانت حقيقية أو خيالية يقال رب الـ؟,عوالم,متوسط
ع,الأعضاء الحساسة المسؤولة عن الرؤية أو ينابيع المياه التي تتفجر من باطن الأرض؟,عيون,متوسط
ع,المشروبات الطبيعية واللذيذة التي تستخرج من عصر الفواكه الطازجة كالبرتقال والتفاح؟,عصائر,متوسط
ع,الطيور الصغيرة والجميلة التي تتميز بتغريدها العذب وألوانها المتنوعة وتبني أعشاشها على الشجر؟,عصافير,متوسط
ع,الحشرات المفصلية ذات الثمانية أرجل والتي تبرع في نسج الشباك الحريرية لاصطياد الفرائس؟,عناكب,متوسط
ع,الإطارات والقطع الدائرية المطاطية أو الخشبية التي تدور وتسمح للسيارات والآلات بالحركة؟,عجلات,متوسط
ع,الأنسجة اللحمية المرنة في الجسم والتي تنقبض وتنبسط وتسمح للإنسان بالحركة ورفع الأثقال؟,عضلات,متوسط
ع,النقود والأموال الورقية والمعدنية الرسمية التي تعتمدها الدول في تعاملاتها كالدولار والريال؟,عملات,متوسط
ع,مراكز التفكير والإدراك والتدبر في الإنسان والتي تميزه عن باقي الكائنات الحية المشتتة؟,عقول,متوسط
ع,الحقب والفترات الزمنية التاريخية الطويلة التي تميزت بأحداث أو حضارات كـ الـ الوسطى؟,عصور,متوسط
ع,المستحضرات السائلة ذات الروائح العطرة والجميلة التي تستخرج من الزهور وتستخدم للتعطر؟,عطور,متوسط
ع,الأعواد الخشبية الرفيعة والمستقيمة التي تستخدم للأكل في آسيا أو لإشعال النار أو تنظيف الأسنان؟,عيدان,متوسط
ع,الشخص التقي والورع الذي يقضي وقته في التقرب لله بالصلوات والدعاء والذكر؟,عابد,متوسط
ع,المادة البيضاء الصلبة والثمينة جداً التي تستخرج من أنياب الفيلة وتصنع منها التحف؟,عاج,متوسط
غ,الطيور ذات اللون الأسود الفاحم والذكاء الحاد والتي ترتبط في بعض الثقافات بالتشاؤم؟,غربان,متوسط
غ,المساحات الشجرية الكثيفة جداً والموجودة في المناطق الاستوائية وتتميز بأمطارها الغزيرة وتسمى؟,غابات مطيرة,متوسط
غ,حالات المادة التي ليس لها شكل ثابت وتنتشر في الهواء كالأكسجين وثاني أكسيد الكربون؟,غازات,متوسط
غ,السفن الحربية أو الاستكشافية المتطورة القادرة على الغوص والبقاء تحت سطح البحر لفترات طويلة؟,غواصات,متوسط
غ,التكبر والتعالي ورؤية النفس أفضل من الآخرين بغير حق وهي صفة مذمومة تسقط صاحبها؟,غرور,متوسط
غ,السلوك الفطري والميل الطبيعي غير المكتسب الذي يولد مع الكائن الحي ويوجهه للبقاء كـ الأمومة؟,غريزة,متوسط
غ,العقوبات والمبالغ المالية التي تفرضها الجهات المرورية أو القانونية على المخالفين للأنظمة؟,غرامات,متوسط
غ,الآلة الكهربائية المنزلية الأساسية التي تستخدم لتنظيف الملابس والأقمشة وإزالة الأوساخ منها؟,غسالة,متوسط
غ,النباتات والأشجار والأعشاب الطبيعية التي تغطي سطح الأرض وتحميها من التصحر والجفاف يسمى؟,غطاء نباتي,متوسط
غ,الحجرة الخاصة والمريحة في المنزل والمجهزة بالسرير والدواليب والمخصصة للنوم والراحة؟,غرفة نوم,متوسط
غ,الكلمات الرقيقة وأشعار الحب والثناء التي تقال للمحبوب للتعبير عن الإعجاب والافتتان؟,غزل,متوسط
غ,رياضة أو نشاط القفز والسباحة تحت سطح الماء وحبس الأنفاس لاستكشاف الأعماق المرجانية؟,غطس,متوسط
غ,الشعور المزعج والمضطرب في المعدة والذي يسبق الرغبة في التقيؤ ويحدث في البحر أو الحمل؟,غثيان,متوسط
غ,الزمن الماضي البعيد جداً والأحداث القديمة التي ولت وانتهت يقال في الزمن الـ؟,غابر,متوسط
غ,الشخص الساهي وغير المنتبه لما يدور حوله من أحداث ومخاطر وتنقصه اليقظة؟,غافل,متوسط
ف,أضخم الحيوانات البرية المعاصرة وتتميز بخرطومها الطويل جداً وأنيابها العاجية الثمينة؟,فيلة,متوسط
ف,الشعب والمواطنون الذين ينتمون لدولة فرنسا الأوروبية ويتحدثون لغتها ويفتخرون ببرج إيفل؟,فرنسيون,متوسط
ف,الحشرات الجميلة والرقيقة ذات الأجنحة الكبيرة والملونة التي تتنقل بين الزهور لامتصاص الرحيق؟,فراشات,متوسط
ف,العلم الواسع الذي يدرس النجوم والكواكب والمجرات وحركتها في الفضاء الخارجي وتسمى علوم الـ؟,فلك,متوسط
ف,المادة السوداء المسامية والصلبة الناتجة عن حرق الخشب بمعزل عن الهواء وتستخدم في الشواء؟,فحم نباتي,متوسط
ف,العظم الصلب والمتحرك في وجه الإنسان والحيوان والذي يحمل الأسنان ويستخدم في مضغ الطعام؟,فك,متوسط
ف,الأدوات الحادة المكونة من مقبض خشبي ورأس حديدي قاطع تستخدم لتكسير الأخشاب والأشجار؟,فؤوس,متوسط
ف,المجموعات المتكاتفة من الأشخاص أو اللاعبين الذين يتحدون ويعملون معاً لتحقيق هدف رياضي أو عملي؟,فرق,متوسط
ف,الأشخاص الأبطال والناجحون الذين تغلبوا على خصومهم ونالوا الجوائز والمراكز الأولى في المنافسات؟,فائزون,متوسط
ف,الحيوانات المفترسة والمنقطة التي تعتبر أسرع الكائنات البرية على وجه الأرض وتعيش في السافانا؟,فهود,متوسط
ف,المباني الضخمة والمجهزة بغرف فاخرة لاستقبال وإقامة السياح والمسافرين مقابل أجر مادي؟,فنادق,متوسط
ف,البذور والقرون الخضراء أو البيضاء التي تعتبر وجبة شعبية أساسية في بعض الدول العربية؟,فاصوليا,متوسط
