letter,question,answer,difficulty
ث,الإنزيم الرئيسي المسؤول عن عملية تخثر الدم في جسم الإنسان عند حدوث الجروح؟,ثرومبين,صعب
ج,نظام حكم يتم فيه اختيار رئيس الدولة عن طريق الانتخاب المباشر أو غير المباشر من الشعب؟,جمهورية,صعب
ج,شركة سيارات أمريكية عملاقة تمتلك علامات تجارية شهيرة مثل شيفروليه وجي إم سي؟,جنرال موتورز,صعب
ج,الحد الفاصل بين كتلتين هوائيتين مختلفتين في درجة الحرارة والكثافة في علم الأرصاد؟,جبهة هوائية,صعب
ج,سلسلة الجبال الأشهر في أوروبا وتمتد عبر عدة دول منها سويسرا وفرنسا وإيطاليا؟,جبال الألب,صعب
ج,كارثة طبيعية تحدث نتيجة نقص حاد في هطول الأمطار لفترة زمنية طويلة؟,جفاف,صعب
ح,المنطقة الواقعة بين كوكبي المريخ والمشتري وتدور فيها ملايين الصخور الفضائية؟,حزام الكويكبات,صعب
ح,منظمة عسكرية دولية تأسست بعد الحرب العالمية الثانية وتعرف بحلف شمال الأطلسي؟,حلف الناتو,صعب
ح,نوع خاص من الحبر لا يرى بالعين المجردة ويستخدم في طباعة الأوراق النقدية لمنع التزوير؟,حبر ألترا بنفسجي,صعب
ح,القدرة على فهم شيء ما غريزياً وبسرعة دون الحاجة إلى التفكير المنطقي أو التحليل الواعي؟,حدس,صعب
ح,الصلاحية التي تمتلكها الدول الخمس الدائمة في مجلس الأمن لإحباط أي قرار وتعرف بـ الفيتو؟,حق النقص,صعب
خ,أعمق نقطة معروفة في محيطات الأرض وتقع في غرب المحيط الهادئ؟,خندق ماريانا,صعب
خ,مادة تصنع من الطين المحروق وتطلى بمواد زجاجية لامعة وتستخدم في الأواني والزينة؟,خزف,صعب
خ,نقوش جيوجليفية عملاقة غامضة محفورة في صحراء بيرو ولا يمكن رؤيتها إلا من الجو؟,خطوط نازكا,صعب
خ,أجهزة شبه موصلة تقوم بتحويل ضوء الشمس مباشرة إلى طاقة كهربائية نظيفة؟,خلايا شمسية,صعب
د,العالم الإنجليزي الذي أثار جدلاً واسعاً بكتابه أصل الأنواع ونظريته في التطور؟,داروين,صعب
د,فيلسوف وعالم رياضيات فرنسي صاحب المقولة الشهيرة أنا أفكر، إذن أنا موجود؟,ديكارت,صعب
د,العلم الإحصائي الذي يدرس الخصائص البشرية للسكان مثل الحجم والتوزيع والنمو؟,ديموغرافيا,صعب
د,النظام الذي يقوم القلب من خلاله بضخ الدم عبر الأوعية الدموية إلى جميع أنحاء الجسم؟,دورة دموية,صعب
د,نادي إنجليزي يعتبر أحد الأعضاء المؤسسين لدوري كرة القدم في إنجلترا عام 1888؟,ديربي كاونتي,صعب
ذ,سبيكة معدنية تنتج عن خلط الذهب الخالص مع معادن بيضاء مثل البلاديوم أو النيكل؟,ذهب أبيض,صعب
ذ,نوع من الذاكرة غير المتطايرة التي يمكن مسحها وإعادة برمجتها إلكترونياً وتستخدم في الـ USB؟,ذاكرة فلاش,صعب
ذ,الجزء السفلي البارز من الوجه أسفل الشفة السفلى ويغطيه الشعر عند الرجال؟,ذقن,صعب
ذ,المعركة البحرية الأولى في الإسلام والتي دمر فيها المسلمون أسطول الروم البيزنطيين؟,ذات الصواري,صعب
ر,مقياس يحدد مدى حمضية أو قاعدية المحاليل المائية ويعرف اختصاراً بـ pH؟,رقم هيدروجيني,صعب
ر,العملة الرسمية المستخدمة في الاتحاد الروسي وبعض الدول المجاورة؟,روبل,صعب
ر,الاسم الأصلي لشركة النفط العملاقة إكسون موبيل قبل اندماجها؟,روكسون,صعب
ر,عملية منع أو تقييد نشر المعلومات أو الأفكار التي تعتبر حساسة أو غير مقبولة سياسياً؟,رقابة,صعب
ر,فن تحريك الصور الرسومية المتسلسلة لإنشاء وهم الحركة وتعرف بالأنيميشن؟,رسوم متحركة,صعب
ز,مادة كيميائية أسطورية مزعومة يعتقد البعض زوراً أنها تستخدم في صناعة الأسلحة النووية؟,زئبق أحمر,صعب
ز,كمية فيزيائية تعبر عن كمية الحركة للجسم وتساوي حاصل ضرب كتلته في سرعته المتجهة؟,زخم,صعب
ز,نبات جذري له نكهة لاذعة يستخدم كبهار في الطبخ وكعلاج طبيعي للغثيان والزكام؟,زنجبيل,صعب
ز,أغلى التوابل في العالم ويستخرج من مياسم زهرة البنفسج ويستخدم لتلوين وإعطاء نكهة للطعام؟,زعفران,صعب
س,مدينة ودولة يونانية قديمة اشتهرت بنظامها العسكري الصارم وقوتها البرية الضاربة؟,سبارتا,صعب
س,الترجمة اللاتينية لعلم النفس وهو الدراسة العلمية للسلوك والعقل والتفكير البشري؟,سيكولوجيا,صعب
س,العلم الذي يدرس العلامات والرموز واستخدامها أو تفسيرها في المجتمع وتعرف بعلم العلامات؟,سيميولوجيا,صعب
س,النشاط الاقتصادي غير القانوني الذي يتم فيه تداول السلع والخدمات بعيداً عن رقابة الدولة؟,سوق سوداء,صعب
س,معدن افتراضي خارق يظهر في قصص الخيال العلمي ليكون الدرع الأقوى غير القابل للتدمير؟,سبيرميتال,صعب
ش,ظاهرة ضوئية طبيعية مذهلة تظهر في سماء المناطق القطبية نتيجة تفاعل الرياح الشمسية؟,شفق قطبي,صعب
ش,أكبر شريان في جسم الإنسان ويخرج من البطين الأيسر للقلب لتوزيع الدم على الأعضاء؟,شريان أبهر,صعب
ش,أيديولوجية سياسية واقتصادية تدعو إلى الملكية العامة لوسائل الإنتاج وإلغاء الطبقات الاجتماعية؟,شيوعية,صعب
ش,رواية بوليسية خيالية شهيرة أثارت الجدل لكاتبها الأمريكي دان براون؟,شفرة دافنشي,صعب
ش,الغلاف الحريري الذي تنسجه اليرقة حول نفسها لتتحول بداخله إلى فراشة أو عثة؟,شرنقة,صعب
ص,مؤسسة مالية دولية تأسست عام 1944 بهدف تعزيز استقرار النظام المالي العالمي؟,صندوق النقد,صعب
ص,القطع الضخمة التي يتكون منها الغلاف الصخري للأرض وتتسبب حركتها في الزلازل والبراكين؟,صفائح تكتونية,صعب
ص,المادة الطبيعية التي تحدد لون البشرة والشعر والعينين وتحمي الجلد من الأشعة البنفسجية؟,صبغة ميلانين,صعب
ص,صواريخ تتبع مساراً مقوساً شبه مداري لإيصال رأس حربي إلى هدف محدد على بعد آلاف الكيلومترات؟,صواريخ باليستية,صعب
ض,الركلة التي تمنح في كرة القدم عندما تخرج الكرة من خط المرمى وكان آخر من لمسها مدافع؟,ضربة ركنية,صعب
ض,الضغط الذي يمنع تدفق المذيب النقي إلى المحلول عبر غشاء شبه منفذ ويعرف بالتناضح؟,ضغط أسموزي,صعب
ض,شبكة معقدة من الأعصاب المتقاطعة والمتشابكة في جسم الإنسان؟,ضفيرة عصبية,صعب
ض,الجزء الوحيد من الطيف الكهرومغناطيسي الذي يمكن للعين البشرية إدراكه ورؤيته بوضوح؟,ضوء مرئي,صعب
ط,كائنات حية تعيش معتمدة على كائن حي آخر يسمى المضيف وتستمد منه غذاءها مسببة له الضرر؟,طفيليات,صعب
ط,الطاقة المخزنة في الجسم نتيجة لشكله أو موضعه أو حالته الكيميائية؟,طاقة كامنة,صعب
ط,حالة الغلاف الجوي في مكان معين خلال فترة زمنية قصيرة كالحرارة والرياح والمطر؟,طقس,صعب
ط,تغير مفاجئ ودائم في تسلسل الحمض النووي (DNA) قد يؤدي إلى ظهور صفات وراثية جديدة؟,طفرة جينية,صعب
ظ,الارتفاع التدريجي في حرارة جو الأرض بسبب زيادة تركيز الغازات الدفيئة كالكربون؟,ظاهرة الاحتباس,صعب
ظ,المنطقة الجافة التي تقع على الجانب المعاكس لاتجاه الرياح من سلسلة جبلية؟,ظل المطر,صعب
ظ,اللاعب الذي يتمركز في الخط الدفاعي الأيمن أو الأيسر في تشكيلة فرق كرة القدم الحديثة؟,ظهير,صعب
ع,أموال رقمية لا مركزية تعتمد على تقنية البلوكتشين وتستخدم التشفير لتأمين المعاملات؟,عملة مشفرة,صعب
ع,الخلية العصبية التي تعتبر الوحدة الأساسية بناء الجهاز العصبي في جسم الكائن الحي؟,عصبون,صعب
ع,الفرع الطبي الذي يدرس أسباب انتشار الأمراض في المجتمعات وكيفية السيطرة عليها ومكافحتها؟,علم الأوبئة,صعب
ع,فترة جيولوجية طويلة انخفضت فيها درجات حرارة الأرض وغطت الأنهار الجليدية مساحات شاسعة؟,عصر جليدي,صعب
غ,غدة صماء تشبه الفراشة تقع في مقدمة الرقبة وتفرز هرمونات تتحكم في عملية الأيض؟,غدة درقية,صعب
غ,جميع المياه الموجودة على سطح الأرض سواء في المحيطات أو الأنهار أو الجليد أو المياه الجوفية؟,غلاف مائي,صعب
غ,الطبقة الخارجية الصلبة لكوكب الأرض والتي تشمل القشرة والجزء العلوي من الوشاح؟,غلاف صخري,صعب
ف,البيئة الافتراضية المعقدة التي تتكون من تفاعل شبكات الكمبيوتر والمعلومات عالمياً؟,فضاء إلكتروني,صعب
ف,عنصر كيميائي شديد التفاعل يضيء في الظلام ويستخدم في صناعة الأسمدة وأعواد الثقاب؟,فوسفور,صعب
ف,المعاهدة التاريخية التي أنهت الحرب العالمية الأولى وفرضت عقوبات قاسية على ألمانيا؟,فرساي,صعب
ف,فرع الفيزياء الذي يدرس خصائص وتفاعلات الأجرام والظواهر السماوية في الكون؟,فيزياء فلكية,صعب
ق,القوة الوهمية التي تبدو وكأنها تدفع الأجسام بعيداً عن مركز الدوران عند حركتها في مسار دائري؟,قوة الطرد المركزي,صعب
ق,عضو حسي بارز في رؤوس الحشرات والمفصليات يستخدم للشم واللمس والتذوق؟,قرن استشعار,صعب
ق,أحد طرفي المغناطيس حيث تكون القوة المغناطيسية أقوى ما يمكن، إما شمالي أو جنوبي؟,قطب مغناطيسي,صعب
ك,العلم الذي يدرس العمليات والمواد الكيميائية التي تحدث داخل الكائنات الحية؟,كيمياء حيوية,صعب
ك,المركبات العضوية التي تشمل السكريات والنشويات وتعتبر المصدر الرئيسي للطاقة في الجسم؟,كربوهيدرات,صعب
ك,جسيمات أولية صغيرة جداً تتحد معاً لتكوين البروتونات والنيوترونات داخل نواة الذرة؟,كوارك,صعب
ل,الحيوانات التي لا تمتلك عموداً فقرياً أو هيكلاً عظمياً داخلياً وتمثل الغالبية العظمى من الحيوانات؟,لافقاريات,صعب
ل,أخف المعادن على الإطلاق ويستخدم بكثافة في صناعة البطاريات القابلة لإعادة الشحن للهواتف والسيارات؟,ليثيوم,صعب
م,الظاهرة الفيزيائية التي تنتج عن حركة الشحنات الكهربائية وتجذب المعادن كالحديد؟,مغناطيسية,صعب
م,أدوية قوية تستخدم لقتل أو إبطاء نمو البكتيريا المسببة للأمراض في الجسم؟,مضادات حيوية,صعب
م,فرع الفيزياء الذي يدرس سلوك الجسيمات دون الذرية مثل الإلكترونات والفوتونات؟,ميكانيكا الكم,صعب
ن,جسم صخري أو معدني يسقط من الفضاء الخارجي ويخترق الغلاف الجوي ليصل إلى سطح الأرض؟,نيزك,صعب
ن,المركز الكثيف جداً والصغير في منتصف الذرة ويحتوي على البروتونات والنيوترونات؟,نواة,صعب
ن,الغاز الذي يشكل النسبة الأكبر من الغلاف الجوي للأرض بنسبة تصل إلى حوالي 78%؟,نيتروجين,صعب
هـ,البروتين الغني بالحديد الموجود في خلايا الدم الحمراء والمسؤول عن نقل الأكسجين لأعضاء الجسم؟,هيموغلوبين,صعب
هـ,التلاعب المباشر بالجينات والحمض النووي للكائن الحي باستخدام التكنولوجيا الحيوية لتغيير صفاته؟,هندسة وراثية,صعب
هـ,تقنية تصوير متقدمة تنتج صوراً ثلاثية الأبعاد باستخدام تداخل أشعة الليزر؟,هولوجرام,صعب
و,الاسم الآخر للحيوان الثديي الوحيد القادر على الطيران ويعتمد على صدى الصوت في حركته؟,وطواط,صعب
و,وعاء دموي يحمل الدم غير المؤكسج من أجزاء الجسم المختلفة عائداً به إلى القلب؟,وريد,صعب
ي,عنصر كيميائي مهم لوظائف الغدة الدرقية ويضاف عادة إلى ملح الطعام للوقاية من تضخمها؟,يود,صعب
ي,العنصر المشع الأساسي الذي يستخدم كوقود لتوليد الطاقة في المفاعلات النووية؟,يورانيوم,صعب
أ,القارة الوحيدة التي لا تملك حكومة مركزية وتعتبر أبرد وأجف قارة في العالم؟,أنتاركتيكا,صعب
أ,عالم فيزياء أمريكي يلقب بـ أبو القنبلة الذرية لعمله في مشروع مانهاتن السري؟,أوبنهايمر,صعب
أ,عالم رياضيات يوناني قديم صاحب المبدأ الشهير المتعلق بالطفو وانزياح السوائل؟,أرخميدس,صعب
أ,الملعب التاريخي لنادي ليفربول والذي شهد أعظم مباريات الريمونتادا في دوري الأبطال؟,أنفيلد,صعب
أ,مصطلح جغرافي يطلق على مجموعة من الجزر المتقاربة من بعضها البعض مثل اليابان والفلبين؟,أرخبيل,صعب
ب,الإمبراطورية الرومانية الشرقية التي استمرت ألف عام بعد سقوط روما وعاصمتها القسطنطينية؟,بيزنطة,صعب
ب,النادي البرتغالي الذي فاز بدوري أبطال أوروبا عام 2004 بقيادة المدرب جوزيه مورينيو؟,بورتو,صعب
ب,لقب ديني يعني المستنير ويطلق على مؤسس ديانة شرقية كبرى انتشرت في الهند والصين؟,بوذا,صعب
ب,كائنات دقيقة وحيدة الخلية بعضها نافع ومهم للهضم وبعضها الآخر مسبب للأمراض؟,بكتيريا,صعب
ب,تقنية أمنية تعتمد على السمات البيولوجية الفريدة للمستخدم مثل بصمة الإصبع أو قزحية العين للتحقق؟,بيومترية,صعب
ت,عالم رياضيات بريطاني يعتبر الأب الروحي لعلوم الحاسوب وله اختبار شهير للذكاء الاصطناعي؟,تورينغ,صعب
ت,المدينة الأوكرانية التي شهدت أسوأ كارثة تسرب إشعاعي نووي في التاريخ عام 1986؟,تشيرنوبيل,صعب
ت,برمجية خبيثة تتنكر كبرنامج شرعي لاختراق الأجهزة وسرقة البيانات دون علم المستخدم؟,تروجان,صعب
ت,سباق رياضي أولمبي شاق يجمع بين ثلاث رياضات متتالية هي السباحة وركوب الدراجات والجري؟,ترياثلون,صعب
ت,المصطلح الذي يطلق على اللوحات الفنية الضخمة التي ترفعها الجماهير في المدرجات قبل بداية المباريات؟,تيفو,صعب
ث,نظام حكم سياسي تستمد فيه الحكومة سلطتها من الدين ويديرها رجال الدين؟,ثيوقراطية,صعب
ث,جهاز بصري هندسي دقيق يستخدم لقياس الزوايا الأفقية والرأسية في أعمال المساحة؟,ثيودوليت,صعب
ث,خليط كيميائي شديد التفاعل يستخدم لإنتاج حرارة عالية جداً لقطع ولحام المعادن كالسكة الحديدية؟,ثرميت,صعب
ث,إله الرعد والبرق في الأساطير النوردية القديمة ويشتهر بمطرقته السحرية المدمرة؟,ثور,صعب
ج,المصطلح العلمي الذي يطلق على كامل المعلومات الوراثية المشفرة في الحمض النووي للكائن الحي؟,جينوم,صعب
ج,فن قتالي ياباني حديث ورياضة أولمبية تعتمد على طرح الخصم أرضاً وتثبيته؟,جودو,صعب
ج,نوع من السفن الشراعية الكبيرة المدججة بالمدافع التي استخدمتها إسبانيا في القرن السادس عشر؟,جاليون,صعب
ج,الحاجز الخرساني الشهير الذي قسم مدينة ألمانية إلى شطرين شرقي وغربي خلال الحرب الباردة؟,جدار برلين,صعب
ج,عاصمة إندونيسيا وأكبر مدنها وتواجه حالياً خطر الغرق بسبب ارتفاع مستوى سطح البحر؟,جاكرتا,صعب
ح,ملك بابلي قديم اشتهر بإصداره واحدة من أقدم وأشمل القوانين المكتوبة في تاريخ البشرية؟,حمورابي,صعب
ح,جيل جديد من التكنولوجيا يعتمد على الكيوبت بدلاً من البت لإجراء حسابات معقدة بسرعة خيالية؟,حوسبة كمومية,صعب
ح,طائفة إسماعيلية باطنية اشتهرت بالاغتيالات السياسية في العصور الوسطى بقيادة حسن الصباح؟,حشاشون,صعب
ح,في الأدب والسينما هي السلسلة المترابطة من الأحداث التي تشكل الهيكل الأساسي للقصة؟,حبكة,صعب
خ,الممارسة القديمة التي مزجت بين الفلسفة والسحر بهدف تحويل المعادن الرخيصة إلى ذهب؟,خيمياء,صعب
خ,مادة بناء صناعية تتكون من الأسمنت والماء والركام وتعتبر الأكثر استخداماً في العالم؟,خرسانة,صعب
خ,منطقة تاريخية في آسيا الوسطى برز منها الكثير من العلماء المسلمين أمثال البيروني؟,خوارزم,صعب
خ,نوع من خلايا الدم البيضاء وظيفتها الأساسية ابتلاع وهضم البكتيريا والخلايا الميتة في الجسم؟,خلايا بلعمية,صعب
د,مصطلح أدبي يصف مجتمعاً خيالياً فاسداً ومخيفاً وهو عكس مجتمع اليوتوبيا أو المدينة الفاضلة؟,ديستوبيا,صعب
د,مادة متفجرة قوية اخترعها الكيميائي السويدي ألفريد نوبل واستخدمت بكثرة في البناء والتعدين؟,ديناميت,صعب
د,الجزيء المزدوج الشريط الذي يحمل التعليمات الوراثية لتطور ووظائف جميع الكائنات الحية؟,دي إن إيه,صعب
د,مباراة كرة قدم تجمع بين فريقين من نفس المدينة وتتسم عادة بالندية والحماس الشديد؟,ديربي,صعب
د,نظام حكم سياسي تتركز فيه السلطة المطلقة في يد شخص واحد أو مجموعة صغيرة دون قيود دستورية؟,ديكتاتورية,صعب
ذ,المصطلح الذي يطلق على أعلى نقطة في الجبل أو أقصى درجات النجاح والتطور؟,ذروة,صعب
ذ,التردد أو الحركة المتأرجحة المنتظمة حول نقطة مركزية وتقاس بوحدة الهرتز الفيزيائية؟,ذبذبة,صعب
ذ,القدرة على إدراك وتقييم والتحكم في عواطف الشخص نفسه وعواطف الآخرين المحيطين به؟,ذكاء عاطفي,صعب
ذ,معركة تاريخية من أيام العرب في الجاهلية انتصرت فيها القبائل العربية على الفرس؟,ذي قار,صعب
ر,المقياس الزلزالي المفتوح الذي يستخدم لتقدير قوة الطاقة المتحررة من الزلازل؟,ريختر,صعب
ر,الكلمة الفرنسية التي تعني عصر النهضة وتشير إلى فترة الانتقال من العصور الوسطى للعصر الحديث؟,رينيسانس,صعب
ر,نوع من سباقات السيارات الطويلة التي تقام على طرق عامة أو وعرة بدلاً من الحلبات المغلقة؟,رالي,صعب
ر,نظام إلكتروني يستخدم الموجات الكهرومغناطيسية لتحديد موقع وسرعة الأجسام البعيدة كطائرات؟,رادار,صعب
ز,عنصر كيميائي فلزي شديد المقاومة للتآكل ويستخدم في المفاعلات النووية وصناعة الأسنان؟,زركونيوم,صعب
ز,معابد مدرجة ضخمة بناها السومريون والبابليون في بلاد الرافدين القديمة للتقرب للآلهة؟,زقورة,صعب
ز,دولة إفريقية تشترك مع زيمبابوي في شلالات فيكتوريا الشهيرة وعاصمتها لوساكا؟,زامبيا,صعب
ز,مصطلح في الثقافة الشعبية يشير إلى الجثث الحية أو الموتى الأحياء الذين فقدوا إرادتهم؟,زومبي,صعب
س,كائن خيالي أو حقيقي يجمع بين المكونات العضوية الحيوية والأجزاء الميكانيكية والإلكترونية؟,سايبورغ,صعب
س,طبقة المحاربين النبلاء في اليابان الإقطاعية والذين اشتهروا بالولاء المطلق والسيوف الحادة؟,ساموراي,صعب
س,ناقل عصبي كيميائي في الدماغ يلعب دوراً رئيسياً في تنظيم المزاج ويسمى هرمون السعادة؟,سيروتونين,صعب
س,سحابة ضخمة من الغاز والغبار في الفضاء الخارجي وتعتبر مسقط رأس النجوم الجديدة؟,سديم,صعب
س,المنطقة التقنية الشهيرة في كاليفورنيا والتي تضم المقرات الرئيسية لأكبر شركات التكنولوجيا في العالم؟,سيليكون فالي,صعب
ش,مصطلح سياسي يعني التعصب القومي الأعمى والاعتقاد بتفوق الأمة على جميع الأمم الأخرى؟,شوفينية,صعب
ش,المدينة الألمانية التي تعتبر المقر الرئيسي لشركتي السيارات الفارهة مرسيدس بنز وبورش؟,شتوتغارت,صعب
ش,المنطقة الأوروبية التي ألغت جوازات السفر وضوابط الحدود الداخلية بين الدول الأعضاء فيها؟,شينغين,صعب
